{
  "schemaVersion": 1,
  "type": "playerAttachment",
  "id": "example.advanced-clothing-showcase:player-attachment/anatomy",
  "sprite": "assets/anatomy.png",
  "pixelsPerUnit": 32,
  "bone": "Hips",
  "attachToBone": true,
  "pivotX": 0.123663686,
  "pivotY": 0.44794855,
  "sortingOffset": 2,
  "tintWithSkin": true
}
